46311,"Venta al por mayor de fiambres, quesos y productos lácteos",4630
46312,"Venta al por mayor de carnes rojas, menudencias y chacinados frescos; productos de granja y de la caza",4630
46313,Venta al por mayor de pescado,4630
46314,"Venta al por mayor y empaque de frutas, de legumbres y hortalizas frescas",4630
46315,"Venta al por mayor de pan, productos de confitería, pastas frescas, aceites, azúcar, café, té, yerba mate y otras infusiones, especias y condimentos",4630
46316,"Venta al por mayor de chocolates, golosinas y productos para kioscos y polirrubros n.c.p., excepto cigarrillos",4630
46317,Venta al por mayor de alimentos balanceados para animales,4630
46318,Venta al por mayor en supermercados mayoristas de alimentos,4630
46319,Venta al por mayor de productos alimenticios n.c.p.,4630
4632,Venta al por mayor de bebidas,
46321,Venta al por mayor de bebidas alcohólicas,4630
46322,Venta al por mayor de bebidas no alcohólicas,4630
4633,Venta al por mayor de cigarrillos y productos de tabaco ,
46330,Venta al por mayor de cigarrillos y productos de tabaco,4630
464,Venta al por mayor de artículos de uso doméstico y/o personal,
4641,"Venta al por mayor de productos textiles, prendas de vestir, calzado excepto el ortopédico, artículos de cuero y piel, artículos de marroquinería,  paraguas y similares ",
46411,"Venta al por mayor de productos textiles, excepto prendas y accesorios de vestir",4641
46412,"Venta al por mayor de prendas y accesorios de vestir, excepto uniformes y ropa de trabajo",4641
46413,"Venta al por mayor de calzado, excepto el ortopédico",4641
46414,"Venta al por mayor de artículos de cuero, pieles, marroquinería, talabartería,  paraguas y similares ",4641
46415,Venta al por mayor de uniformes y ropa trabajo,4641
4642,"Venta al por mayor de libros, revistas, diarios, papel, cartón, materiales de embalaje y artículos de librería",
46421,"Venta al por mayor de libros, revistas, diarios y otras publicaciones",4649
46422,"Venta al por mayor de papel, cartón, materiales de embalaje y artículos de librería",4649
4643,"Venta al por mayor de productos farmacéuticos, veterinarios, cosméticos y de perfumería, instrumental médico y odontológico, y artículos ortopédicos",
46431,Venta al por mayor de productos farmacéuticos ,4649
46432,"Venta al por mayor de productos cosméticos, de tocador y de perfumería",4649
46433,"Venta al por mayor de instrumental médico y odontológico, y artículos ortopédicos",4649
46434,Venta al por mayor de productos veterinarios,4649
4644,"Venta al por mayor de artículos de óptica, fotografía, relojería, joyería y fantasías",
46441,Venta al por mayor de artículos de óptica y de fotografía,4649
46442,"Venta al por mayor de artículos de relojería, joyería y fantasías",4649
4645,"Venta al por mayor de electrodomésticos, artefactos para el hogar y equipos de audio y video",
46450,"Venta al por mayor de electrodomésticos, artefactos para el hogar y equipos de audio y video",4649
4646,"Venta al por mayor de muebles, artículos de iluminación y artículos de bazar y menaje",
46461,Venta al por mayor de muebles excepto de oficina; artículos de mimbre y corcho; colchones y somieres,4649
46462,Venta al por mayor de artículos de iluminación ,4649
46463,Venta al por mayor de artículos de bazar y menaje,4649
4649,Venta al por mayor de artículos de uso doméstico y/o personal n.c.p.,
46491,Venta al por mayor de CD y DVD de audio y video grabados,4649
46492,Venta al por mayor de materiales y productos de limpieza,4649
46493,Venta al por mayor de juguetes,4649
46494,Venta al por mayor de bicicletas y rodados similares,4649
46495,Venta al por mayor de artículos de esparcimiento y deportes (incluye: armas y municiones),4649
46499,Venta al por mayor artículos de uso doméstico o personal n.c.p.,4649
465,"Venta al por mayor de máquinas, equipo y materiales conexos",
4651,"Venta al por mayor de equipos, periféricos, accesorios y programas informáticos",
46510,"Venta al por mayor de equipos, periféricos, accesorios y programas informáticos",4651
4652,Venta al por mayor de equipos de telefonía y comunicaciones y componentes electrónicos,
46521,Venta al por mayor de equipos de telefonía y comunicaciones,4652
46522,Venta al por mayor de componentes electrónicos,4652
4653,"Venta al por mayor de máquinas, equipos e implementos de uso especial",
46531,"Venta al por mayor de máquinas, equipos e implementos de uso en los sectores agropecuario, jardinería, silvicultura, pesca y caza",4653
46532,"Venta al por mayor de máquinas, equipos e implementos de uso en la elaboración de alimentos, bebidas y tabaco",4659
46533,"Venta al por mayor de máquinas, equipos e implementos de uso en la fabricación de textiles, prendas y accesorios de vestir, calzado, artículos de cuero y marroquinería",4659
46534,"Venta al por mayor de máquinas, equipos e implementos de uso en imprentas, artes gráficas y actividades conexas",4659
46535,"Venta al por mayor de máquinas, equipos e implementos de uso médico y paramédico",4659
46536,"Venta al por mayor de máquinas, equipos e implementos de uso en la industria del plástico y el caucho",4659
46539,"Venta al por mayor de máquinas, equipos e implementos de uso especial n.c.p. ",4659
4654,Venta al por mayor de máquinas-herramientas de uso general,
46540,Venta al por mayor de máquinas-herramientas de uso general,4659
4655,"Venta al por mayor de vehículos, equipos y máquinas para el transporte ferroviario, aéreo y de navegación",4659
46550,"Venta al por mayor de vehículos, equipos y máquinas para el transporte ferroviario, aéreo y de navegación",4659
4656,"Venta al por mayor de muebles e instalaciones para la industria, el comercio y los servicios",4659
46561,Venta al por mayor de muebles e instalaciones para oficinas,4659
46569,"Venta al por mayor de muebles e instalaciones para la industria, el comercio y los servicios n.c.p.",4659
4659,"Venta al por mayor de máquinas, equipos e implementos n.c.p.",4659
46591,Venta al por mayor de máquinas y equipos de control y seguridad,4659
46592,"Venta al por mayor de maquinaria y equipo de oficina, excepto equipo informático",4659
46593,Venta al por mayor de equipo profesional y científico e instrumentos de medida y de control n.c.p.,4659
46599,"Venta al por mayor de máquinas, equipo y materiales conexos n.c.p.",4659
466,Venta al por mayor especializada,
4661,"Venta al por mayor de combustibles, incluso gaseosos y productos conexos",
46611,Venta al por mayor de combustibles y lubricantes para automotores,4661
46612,"Venta al por mayor de combustibles y lubricantes, gas en garrafas, leña y carbón; excepto combustibles y lubricantes para automotores (incluye: fraccionamiento de estos productos)",4661
4662,Venta al por mayor de metales y minerales metalíferos,
46620,Venta al por mayor de metales y minerales metalíferos,4662
4663,"Venta al por mayor de madera, materiales de construcción, artículos de ferretería y materiales para plomería e instalaciones de gas",
46631,Venta al por mayor de aberturas,4663
46632,"Venta al por mayor de productos de madera, excepto muebles",4663
46633,Venta al por mayor de artículos de ferretería y materiales eléctricos,4663
46634,Venta al por mayor de pinturas y productos conexos,4663
46635,Venta al por mayor de cristales y espejos,4663
46636,Venta al por mayor de artículos para plomería; instalación de gas y calefacción,4663
46637,"Venta al por mayor de papeles para pared, revestimiento para pisos de goma, plástico y textiles, y artículos similares para la decoración",4663
46639,Venta al por mayor de artículos para la construcción n.c.p.,4663
4669,"Venta al por mayor de productos intermedios n.c.p., desperdicios y desechos",
46691,"Venta al por mayor de productos intermedios n.c.p., desperdicios y desechos textiles",4669
46692,"Venta al por mayor de productos intermedios n.c.p., desperdicios y desechos de papel y cartón",4669
46693,"Venta al por mayor de productos intermedios, desperdicios y desechos de vidrio, plástico, caucho, goma y químicos",4669
46694,"Venta al por mayor de productos intermedios, desperdicios y desechos metálicos",4669
46699,"Venta al por mayor de productos intermedios, desperdicios y desechos n.c.p.",4669
469,Venta al por mayor de mercancías n.c.p.,
4690,Venta al por mayor de mercancías n.c.p.,
46901,Venta al por mayor de insumos agropecuarios diversos,4690
46909,Venta al por mayor de mercancías n.c.p.,4690
47,"COMERCIO AL POR MENOR, EXCEPTO EL COMERCIO DE VEHÍCULOS AUTOMOTORES Y MOTOCICLETAS",
471,Venta al por menor en comercios no especializados,
4711,"Venta al por menor en comercios no especializados, con predominio de productos alimenticios y bebidas",
47111,Venta al por menor en hipermercados,4711
47112,Venta al por menor en supermercados,4711
47113,Venta al por menor en minimercados,4711
47119,"Venta al por menor en kioscos, polirrubros y comercios no especializados n.c.p.",4711
4719,"Venta al por menor en comercios no especializados, sin predominio de productos alimenticios y bebidas",
47190,"Venta al por menor en comercios no especializados, sin predominio de productos alimenticios y bebidas",4719
472,"Venta al por menor de productos alimenticios, bebidas y tabaco en comercios especializados",
4721,Venta al por menor de productos alimenticios en comercios especializados,
47211,"Venta al por menor principalmente de fiambres, quesos y productos lácteos",4721
47212,Venta al por menor de productos de almacén y dietética,4721
47213,"Venta al por menor de carnes rojas, menudencias y chacinados frescos",4721
47214,"Venta al por menor de huevos, carne de aves y productos de granja y de la caza",4721
47215,Venta al por menor de pescados y productos de la pesca,4721
47216,"Venta al por menor de frutas, legumbres y hortalizas frescas",4721
47217,Venta al por menor de pan y productos de panadería y confitería,4721
47219,Venta al por menor de productos alimenticios n.c.p. en comercios especializados,4721
4722,Venta al por menor de bebidas,
47220,Venta al por menor de bebidas,4722
4723,Venta al por menor de tabaco,
47230,Venta al por menor de tabaco,4723
473,Venta al por menor de combustible para vehículos automotores y motocicletas,
4730,Venta al por menor de combustible para vehículos automotores y motocicletas,
47300,Venta al por menor de combustible para vehículos automotores y motocicletas ,4730
474,"Venta al por menor de equipos, periféricos, accesorios y programas informáticos; equipos de telecomunicaciones en comercios especializados",
4740,"Venta al por menor de equipos, periféricos, accesorios y programas informáticos; equipos de telecomunicaciones en comercios especializados",
47401,"Venta al por menor de equipos, periféricos, accesorios y programas informáticos",4741
47402,Venta al por menor de aparatos de telefonía y comunicación,4741
475,Venta al por menor de artículos de uso doméstico n.c.p. en comercios especializados,
4751,"Venta al por menor de productos textiles, excepto prendas de vestir",
47511,"Venta al por menor de hilados, tejidos y artículos de mercería",4751
47512,Venta al por menor de confecciones para el hogar,4751
47512,Venta al por menor de confecciones para el hogar,4753
47519,"Venta al por menor de artículos textiles n.c.p., excepto prendas de vestir",4751
47519,"Venta al por menor de artículos textiles n.c.p., excepto prendas de vestir",4753
4752,"Venta al por menor de materiales de construcción, artículos de ferretería, pinturas, cristales y espejos, y artículos para decoración",
47521,Venta al por menor de aberturas,4752
47522,"Venta al por menor de maderas y artículos de madera  y corcho, excepto muebles",4752
47522,"Venta al por menor de maderas y artículos de madera  y corcho, excepto muebles",4759
47523,Venta al por menor de artículos de ferretería y materiales eléctricos,4752
47524,Venta al por menor de pinturas y productos conexos,4752
47525,Venta al por menor de artículos para plomería e instalación de gas,4752
47526,"Venta al por menor de cristales, espejos, mamparas y cerramientos",4752
47527,"Venta al por menor de papeles para pared, revestimientos para pisos y artículos similares para la decoración: casas de decoración",4753
47529,Venta al por menor de materiales de construcción n.c.p.,4752
4753,"Venta al por menor de electrodomésticos, artefactos para el hogar y equipos de audio y video",
47530,"Venta al por menor de electrodomésticos, artefactos para el hogar y equipos de audio y video",4742
47530,"Venta al por menor de electrodomésticos, artefactos para el hogar y equipos de audio y video",4759
4754,"Venta al  por menor de muebles, artículos de mimbre y corcho, colchones y somieres, artículos de  iluminación y artículos para el hogar n.c.p.",
47541,"Venta al por menor de muebles para el hogar, artículos de mimbre y corcho",4759
47542,Venta al por menor de colchones y somieres,4759
47543,Venta al por menor de artículos de iluminación ,4759
47544,Venta al por menor de artículos de bazar y menaje,4759
47549,Venta al por menor de artículos para el hogar n.c.p.,4759
476,Venta al por menor de bienes culturales y recreativos en comercios especializados,
4761,"Venta al por menor de libros, revistas, diarios, papel, cartón, materiales de embalaje y artículos de librería",
47611,Venta al por menor de libros,4761
47612,Venta al por menor de diarios y revistas,4761
47613,"Venta al por menor de papel, cartón, materiales de embalaje y artículos de librería ",4761
4762,Venta al por menor de CD y DVD de audio y video grabados,
47620,Venta al por menor de CD y DVD de audio y video grabados (incluye: CD y DVD vírgenes),4762
4763,Venta al por menor de equipos y artículos deportivos y de esparcimiento,
47631,"Venta al por menor de equipos y artículos deportivos (incluye: venta de bicicletas, embarcaciones deportivas)",4763
47632,"Venta al por menor de armas, artículos para la caza y pesca",4773
4764,Venta al por menor de juguetes; artículos de cotillón y juegos de mesa,
47640,Venta al por menor de juguetes; artículos de cotillón y juegos de mesa,4764
477,Venta al por menor de productos n.c.p. en comercios especializados,
4771,"Venta al por menor de prendas y accesorios de vestir excepto calzado, artículos de marroquinería, paraguas y similares",
47711,"Venta al por menor de ropa interior, medias, prendas para dormir y para la playa",4771
47712,Venta al por menor de uniformes escolares y guardapolvos,4771
47713,Venta al por menor de indumentaria para bebés y niños,4771
47714,Venta al por menor de indumentaria deportiva,4771
47715,Venta al por menor de prendas de cuero,4771
47719,Venta al por menor de prendas y accesorios de vestir n.c.p.,4771
4772,"Venta al por menor de calzado, excepto el ortopédico, artículos de marroquinería, paraguas y similares",
47721,Venta al por menor de artículos de talabartería y artículos regionales,4771
47722,"Venta al por menor de calzado, excepto el ortopédico y el deportivo",4771
47723,Venta al por menor de calzado deportivo,4771
47729,"Venta al por menor de artículos de marroquinería, paraguas y similares n.c.p.",4771
4773,"Venta al por menor de productos farmacéuticos, cosméticos, de perfumería, instrumental médico y odontológico, y artículos ortopédicos",
47731,Venta al por menor de productos farmacéuticos y de herboristería,4772
47732,"Venta al por menor de productos cosméticos, de tocador y de perfumería",4772
47733,Venta al por menor de instrumental médico y odontológico y artículos ortopédicos,4772
4774,Venta al por menor de productos n.c.p. en comercios especializados,
47741,Venta al por menor de artículos de óptica y fotografía,4773
47742,Venta al por menor de artículos de relojería y joyería ,4773
47743,Venta al por menor de bijouterie y fantasía,4773
47744,"Venta al por menor de flores, plantas, semillas, abonos, fertilizantes y otros productos de vivero",4773
47745,Venta al por menor de materiales y productos de limpieza,4773
47746,"Venta al por menor de fueloil, gas en garrafas, carbón y leña",4773
47747,"Venta al por menor de productos veterinarios, animales domésticos y alimento balanceado para mascotas",4773
47748,Venta al por menor de obras de arte,4773
47749,Venta al por menor de artículos nuevos n.c.p.,4773
4778,"Venta al por menor de artículos usados, excepto vehículos automotores y motocicletas",
47781,Venta al por menor de muebles usados,4774
47782,"Venta al por menor de libros, revistas y similares usados",4774
47783,Venta al por menor de antigüedades,4774
47784,"Venta al por menor de oro, monedas, sellos y similares",4774
47789,"Venta al por menor de artículos usados n.c.p., excepto vehículos automotores y motocicletas ",4774
478,Venta al por menor en puestos móviles y mercados,
4780,Venta al por menor en puestos móviles y mercados,
47801,"Venta al por menor de alimentos, bebidas y tabaco en puestos móviles y mercados",4781
47809,"Venta al por menor de productos n.c.p., en puestos móviles y mercados",4782
47809,"Venta al por menor de productos n.c.p., en puestos móviles y mercados",4789
479,"Venta al por menor no realizada en comercios, puestos o mercados",
4791,"Venta al por menor  por correo, televisión, internet y otros medios de comunicación",
47910,"Venta al por menor por correo, televisión, internet y otros medios de comunicación",4791
4799,Venta al por menor no realizada en establecimientos n.c.p.,
47990,Venta al por menor no realizada en establecimientos n.c.p.,4799
H,SERVICIO DE TRANSPORTE Y ALMACENAMIENTO ,
49,SERVICIO DE TRANSPORTE TERRESTRE,
491,Servicio de transporte ferroviario,
4911,Servicio de transporte ferroviario de pasajeros,
49111,Servicio de transporte ferroviario urbano y suburbano de pasajeros,4921
49112,Servicio de transporte ferroviario interurbano de pasajeros,4911
4912,Servicio de transporte ferroviario de cargas,
49120,Servicio de transporte ferroviario de cargas,4912
492,Servicio de transporte automotor,
4921,Servicio de transporte automotor de pasajeros,
49211,Servicio de transporte automotor urbano y suburbano regular de pasajeros ,4921
49212,Servicio de transporte automotor de pasajeros mediante taxis y remises; alquiler de autos con chofer (incluye: radiotaxis),4921
49213,Servicio de transporte escolar,4921
49214,"Servicio de transporte automotor urbano y suburbano no regular de pasajeros de oferta libre; excepto mediante taxis y remises, alquiler de autos con chofer y transporte escolar",4921
49215,Servicio de transporte automotor interurbano regular de pasajeros; excepto el transporte internacional,4922
49216,Servicio de transporte automotor interurbano no regular de pasajeros,4922
49217,Servicio de transporte automotor internacional de pasajeros,4922
49218,Servicio de transporte automotor turístico de pasajeros,4922
49219,Servicio de transporte automotor de pasajeros n.c.p.,4922
4922,Servicio de transporte automotor de cargas,
49221,Servicio de mudanza,4923
49222,Servicio de transporte automotor de mercaderías a granel,4923
49223,Servicio de transporte automotor de animales,4923
49224,Servicio de transporte por camión cisterna,4923
49225,Servicio de transporte automotor de mercaderías y sustancias peligrosas,4923
49228,Servicio de transporte automotor urbano de cargas n.c.p.,4923
49229,Servicio de transporte automotor de cargas n.c.p.,4923
493,Servicio de transporte por tuberías,
4931,Servicio de transporte por oleoductos y poliductos,
49311,Servicio de transporte por oleoductos,4930
49312,Servicio de transporte por poliductos y fueloductos,4930
4932,Servicio de transporte por gasoductos,
49320,Servicio de transporte por gasoductos,4930
50,SERVICIO DE TRANSPORTE POR VÍA ACUÁTICA,
501,Servicio de transporte marítimo,
5011,Servicio de transporte marítimo de pasajeros,
50110,Servicio de transporte marítimo de pasajeros,5011
5012,Servicio de transporte marítimo de carga,
50120,Servicio de transporte marítimo de carga,5012
502,Servicio de transporte fluvial y lacustre,
5021,Servicio de transporte fluvial y lacustre de pasajeros,
50210,Servicio de transporte fluvial y lacustre de pasajeros,5021
5022,Servicio de transporte fluvial y lacustre de cargas,
50220,Servicio de transporte fluvial y lacustre de cargas,5022
51,SERVICIO DE TRANSPORTE AÉREO,
511,Servicio de transporte aéreo de pasajeros,
5110,Servicio de transporte aéreo de pasajeros,
51100,Servicio de transporte aéreo de pasajeros,5110
512,Servicio de transporte aéreo de cargas,
5120,Servicio de transporte aéreo de cargas,
51200,Servicio de transporte aéreo de cargas,5120
52,SERVICIOS DE MANIPULACIÓN Y DE ALMACENAMIENTO; SERVICIOS DE APOYO AL TRANSPORTE,
521,Servicios de manipulación de cargas,
5210,Servicios de manipulación de cargas en el ámbito terrestre,
52101,Servicios de manipulación de cargas en el ámbito terrestre,5224
52102,Servicios de manipulación de cargas en el ámbito portuario,5224
52103,Servicios de manipulación de cargas en el ámbito aéreo,5224
522,Servicios de almacenamiento y depósito,
5220,Servicios de almacenamiento y depósito,
52201,Servicios de almacenamiento y depósito en silos,5210
52202,Servicios de almacenamiento y depósito en cámaras frigoríficas,5210
52209,Servicios de almacenamiento y depósito n.c.p.,5210
523,Servicios de gestión y logística para el transporte de mercaderías,
52301,Servicios de gestión aduanera para el transporte de mercaderías,5229
52302,Servicios de agencias marítimas para el transporte de mercaderías,5229
52303,Servicios de operadores logísticos,5229
52309,Servicios de gestión y logística para el transporte de mercaderías n.c.p.,5229
524,Servicios complementarios para el transporte,
5241,Servicios complementarios para el transporte terrestre,
52411,"Servicios de explotación de infraestructura, peajes y otros derechos",5221
52412,Servicios de playas de estacionamiento y garajes,5221
52413,Servicios de estaciones terminales de ómnibus y ferroviarias,5221
52419,Servicios complementarios para el transporte terrestre n.c.p.,5221
5242,Servicios complementarios para el transporte por vía acuática,
52421,Servicios de explotación de infraestructura; derechos de puerto,5222
52422,Servicios de guarderías náuticas,5222
52423,Servicios para la navegación,5222
52429,Servicios complementarios para el transporte por vía acuática n.c.p.,5222
5243,Servicios complementarios para el transporte aéreo,
52431,"Servicios de explotación de infraestructura, derechos de aeropuertos",5223
52432,Servicios de hangares y estacionamiento de aeronaves,5223
52433,Servicios para la aeronavegación,5223
52439,Servicios complementarios para el transporte aéreo n.c.p.,5223
53,SERVICIO DE CORREOS Y MENSAJERÍAS,
530,Servicios de correos y mensajerías,
5300,Servicios de correos y mensajerías,
53001,Servicio de correo postal,5310
53009,Servicio de mensajerías,5320
I,SERVICIOS DE ALOJAMIENTO Y SERVICIOS DE COMIDA,
55,SERVICIOS DE ALOJAMIENTO,
551,"Servicios de alojamiento, excepto en camping",
5510,"Servicios de alojamiento, excepto en camping",
55101,Servicios de alojamiento por hora (incluye: albergues transitorios),5510
55102,"Servicios de alojamiento en hoteles, pensiones y similares, excepto por  hora (incluye: hoteles, apart hotel, cabañas, hostels, pensiones)",5510
55109,"Servicios de alojamiento temporal n.c.p. (incluye: residencias para estudiantes, coches camas, albergues para trabajadores)",5590
552,Servicios de alojamiento en campings,
5520,Servicios de alojamiento en campings,
55200,Servicios de alojamiento en campings,5520
56,SERVICIOS DE COMIDAS Y BEBIDAS,
561,Servicios de expendio de comidas y bebidas,
5610,Servicios de expendio de comidas y bebidas,
56101,"Servicios de expendio de comidas y bebidas en restaurantes, bares y otros establecimientos con servicio de mesa y/o en mostrador",5610
56101,"Servicios de expendio de comidas y bebidas en restaurantes, bares y otros establecimientos con servicio de mesa y/o en mostrador",5630
56102,"Servicios de preparación de comidas para llevar (incluye: rotiserías, casas de empanadas, pizzerías sin consumo en el local)",5610
56103,Servicio de expendio de helados,5610
56104,Servicios de preparación de comidas realizada por/para vendedores ambulantes,5610
562,Servicios de preparación de comidas para empresas y servicios de comida n.c.p.,
5620,Servicios de preparación de comidas para empresas y servicios de comida n.c.p.,
56201,Servicios de preparación de comidas para empresas y eventos,5621
56209,Servicios de comidas n.c.p.,5629
J,INFORMACIÓN Y COMUNICACIONES,
58,SERVICIOS DE EDICIÓN,
581,Edición,
5811,"Edición de libros, folletos y otras publicaciones",
58110,"Edición de libros, folletos y otras publicaciones",5811
5812,Edición de directorios y listas de correos,
58120,Edición de directorios y listas de correos,5812
5813,"Edición de periódicos, revistas y publicaciones periódicas",
58130,"Edición de periódicos, revistas y publicaciones periódicas",5813
5819,Edición n.c.p.,
58190,Edición n.c.p.,5819
59,SERVICIOS DE CINEMATOGRAFÍA,
591,Servicios de cinematografía,
5911,Producción y posproducción de filmes y videocintas,
59111,Producción filmes y videocintas,5911
59112,Posproducción de filmes y videocintas,5912
5912,Distribución de filmes y videocintas,
59120,Distribución de filmes y videocintas,5913
5913,Exhibición de filmes y videocintas,
59130,Exhibición de filmes y videocintas,5914
592,Servicios de grabación de sonido y edición de música,
5920,Servicios de grabación de sonido y edición de música,
59200,Servicios de grabación de sonido y edición de música,5920
60,SERVICIOS DE RADIO Y TELEVISIÓN,
601,Emisión y retransmisión de radio,
6010,Emisión y retransmisión de radio,
60100,Emisión y retransmisión de radio,6010
602,Servicios de televisión,
6021,Servicios de difusión de televisión,
60210,Emisión y retransmisión de televisión abierta,6020
6022,Operadores de televisión por suscripción,
